{"capabilities":{"cross_host_read_after_rename":[{"error":null,"file_sha256":"d19c4c4e549f2c1723ed47dd1523bcffcf393e67199121115167cad9b9341b9a","host":"<host>","ok":true},{"error":null,"file_sha256":"d19c4c4e549f2c1723ed47dd1523bcffcf393e67199121115167cad9b9341b9a","host":"<host>","ok":true}],"cross_host_required":false,"directory_fsync_error":null,"directory_fsync_supported":true,"driver_host":"<host>","file_lock_required":false,"filesystem_type":"ext4","hardlink_required":false,"max_metadata_visibility_latency_seconds":0.00011924598948098719,"reopen_after_rename_sha256":"d19c4c4e549f2c1723ed47dd1523bcffcf393e67199121115167cad9b9341b9a","same_directory_atomic_replace_visible":true,"same_directory_replace_latency_seconds":1.528498250991106e-05,"symlink_policy":{"symlink_create_allowed":true,"symlink_target":"rename_probe.dat"},"symlink_required":false,"worker_hosts":["<host>"]},"capability_digest":"e0a78261b0d0ab1e7e3c171204bd9026a38a363ad3072ca17750bb13ff2308cc","run_digest":"dbfb65ebc094b5b5624ef040276fc114","schema":"mosaic.fs_capability","schema_version":1}
