{"capabilities":{"cross_host_read_after_rename":[{"error":null,"file_sha256":"cf0166974ec92e5c71771048ad2df84e565e4effd9d8da19c9408b7cc004e9ee","host":"<host>","ok":true},{"error":null,"file_sha256":"cf0166974ec92e5c71771048ad2df84e565e4effd9d8da19c9408b7cc004e9ee","host":"<host>","ok":true}],"cross_host_required":false,"directory_fsync_error":null,"directory_fsync_supported":true,"driver_host":"<host>","file_lock_required":false,"filesystem_type":"ext4","hardlink_required":false,"max_metadata_visibility_latency_seconds":3.441399894654751e-05,"reopen_after_rename_sha256":"cf0166974ec92e5c71771048ad2df84e565e4effd9d8da19c9408b7cc004e9ee","same_directory_atomic_replace_visible":true,"same_directory_replace_latency_seconds":1.6170000890269876e-05,"symlink_policy":{"symlink_create_allowed":true,"symlink_target":"rename_probe.dat"},"symlink_required":false,"worker_hosts":["<host>"]},"capability_digest":"c6b3f3291fdfead2828c6cc391fa5ec193fc8c64ffad4518b4f5165264db5980","run_digest":"e19bfd6556fe6b98376d35ffb02b476d","schema":"mosaic.fs_capability","schema_version":1}
