{"capabilities":{"cross_host_read_after_rename":[{"error":null,"file_sha256":"49d5aa3cb6014a0d94695bfe30fd2d0278ead0c2ba1fc3516feb5f82c3a900aa","host":"<host>","ok":true},{"error":null,"file_sha256":"49d5aa3cb6014a0d94695bfe30fd2d0278ead0c2ba1fc3516feb5f82c3a900aa","host":"<host>","ok":true}],"cross_host_required":false,"directory_fsync_error":null,"directory_fsync_supported":true,"driver_host":"<host>","file_lock_required":false,"filesystem_type":"ext4","hardlink_required":false,"max_metadata_visibility_latency_seconds":3.902098978869617e-05,"reopen_after_rename_sha256":"49d5aa3cb6014a0d94695bfe30fd2d0278ead0c2ba1fc3516feb5f82c3a900aa","same_directory_atomic_replace_visible":true,"same_directory_replace_latency_seconds":1.8615974113345146e-05,"symlink_policy":{"symlink_create_allowed":true,"symlink_target":"rename_probe.dat"},"symlink_required":false,"worker_hosts":["<host>"]},"capability_digest":"b568c0770d00838fd8c6d9e0ab17986624a70eb054c30ac47607ae58a579fdda","run_digest":"9d26d22f686f8f23f572f4e04cbed242","schema":"mosaic.fs_capability","schema_version":1}
