{"capabilities":{"cross_host_read_after_rename":[{"error":null,"file_sha256":"0b459a5deef4faba749f8f9b21309f6eaefebe0220f0c838c8f021981a5f704d","host":"<host>","ok":true},{"error":null,"file_sha256":"0b459a5deef4faba749f8f9b21309f6eaefebe0220f0c838c8f021981a5f704d","host":"<host>","ok":true}],"cross_host_required":false,"directory_fsync_error":null,"directory_fsync_supported":true,"driver_host":"<host>","file_lock_required":false,"filesystem_type":"ext4","hardlink_required":false,"max_metadata_visibility_latency_seconds":0.00014279299648478627,"reopen_after_rename_sha256":"0b459a5deef4faba749f8f9b21309f6eaefebe0220f0c838c8f021981a5f704d","same_directory_atomic_replace_visible":true,"same_directory_replace_latency_seconds":1.780697493813932e-05,"symlink_policy":{"symlink_create_allowed":true,"symlink_target":"rename_probe.dat"},"symlink_required":false,"worker_hosts":["<host>"]},"capability_digest":"08f1176f8e151b4a4c163ad6333632a716b9e6f4c8e19fdc3f233c9ec9a12936","run_digest":"a959a6d4e5c01aeca9acac1aecac8cccd57c50cdff0866d1303418e16fefec4d","schema":"mosaic.fs_capability","schema_version":1}
