{"capabilities":{"cross_host_read_after_rename":[{"error":null,"file_sha256":"753aa40be08b0edb903e28f2fe3a8e45f28d1cc4f62fbe9519f4a47b15fafc88","host":"<host>","ok":true},{"error":null,"file_sha256":"753aa40be08b0edb903e28f2fe3a8e45f28d1cc4f62fbe9519f4a47b15fafc88","host":"<host>","ok":true}],"cross_host_required":false,"directory_fsync_error":null,"directory_fsync_supported":true,"driver_host":"<host>","file_lock_required":false,"filesystem_type":"ext4","hardlink_required":false,"max_metadata_visibility_latency_seconds":0.0006641189975198358,"reopen_after_rename_sha256":"753aa40be08b0edb903e28f2fe3a8e45f28d1cc4f62fbe9519f4a47b15fafc88","same_directory_atomic_replace_visible":true,"same_directory_replace_latency_seconds":1.7362006474286318e-05,"symlink_policy":{"symlink_create_allowed":true,"symlink_target":"rename_probe.dat"},"symlink_required":false,"worker_hosts":["<host>"]},"capability_digest":"41752c55aae5205748dfc52e471dfa9656c660a4a2742ecbad8c966a1183e52d","run_digest":"7279fde1be446dba4889dd554e083538c5a10b2f34fdd2e21275f969f67982ac","schema":"mosaic.fs_capability","schema_version":1}
