{"capabilities":{"cross_host_read_after_rename":[{"error":null,"file_sha256":"e64ed2e480a662365fdf01db4daf3b4269d2ee2959a1c936fd64181562392da3","host":"<host>","ok":true},{"error":null,"file_sha256":"e64ed2e480a662365fdf01db4daf3b4269d2ee2959a1c936fd64181562392da3","host":"<host>","ok":true}],"cross_host_required":false,"directory_fsync_error":null,"directory_fsync_supported":true,"driver_host":"<host>","file_lock_required":false,"filesystem_type":"ext4","hardlink_required":false,"max_metadata_visibility_latency_seconds":0.00012641100329346955,"reopen_after_rename_sha256":"e64ed2e480a662365fdf01db4daf3b4269d2ee2959a1c936fd64181562392da3","same_directory_atomic_replace_visible":true,"same_directory_replace_latency_seconds":1.8293008906766772e-05,"symlink_policy":{"symlink_create_allowed":true,"symlink_target":"rename_probe.dat"},"symlink_required":false,"worker_hosts":["<host>"]},"capability_digest":"d9177add20ab154b0d24af566f2e0bc246072c38adb0004e6cbd22d202b8c43b","run_digest":"0d7c84a780eb79abc89bd6d2b9a4294be39ae45b0c4833b5b0166c200a77392a","schema":"mosaic.fs_capability","schema_version":1}
