{"capabilities":{"cross_host_read_after_rename":[{"error":null,"file_sha256":"4f4ba3b7afff0a2bd07cb9b25b43342c402cb965c94de214edfead5d49c9c691","host":"<host>","ok":true},{"error":null,"file_sha256":"4f4ba3b7afff0a2bd07cb9b25b43342c402cb965c94de214edfead5d49c9c691","host":"<host>","ok":true}],"cross_host_required":false,"directory_fsync_error":null,"directory_fsync_supported":true,"driver_host":"<host>","file_lock_required":false,"filesystem_type":"ext4","hardlink_required":false,"max_metadata_visibility_latency_seconds":3.8413010770455e-05,"reopen_after_rename_sha256":"4f4ba3b7afff0a2bd07cb9b25b43342c402cb965c94de214edfead5d49c9c691","same_directory_atomic_replace_visible":true,"same_directory_replace_latency_seconds":2.3264001356437802e-05,"symlink_policy":{"symlink_create_allowed":true,"symlink_target":"rename_probe.dat"},"symlink_required":false,"worker_hosts":["<host>"]},"capability_digest":"56a16b1a08496ea25bc02aa6c0cd7a8510dd80b06dbb1a39aef487b447dac7be","run_digest":"f673ba4e0bb4e169e95f1363c5f46f3c","schema":"mosaic.fs_capability","schema_version":1}
