{"capabilities":{"cross_host_read_after_rename":[{"error":null,"file_sha256":"ca579451224bd74f92c0f5ad155d59c75a3cea3c25c617be4e67801381d7e4c4","host":"<host>","ok":true},{"error":null,"file_sha256":"ca579451224bd74f92c0f5ad155d59c75a3cea3c25c617be4e67801381d7e4c4","host":"<host>","ok":true}],"cross_host_required":false,"directory_fsync_error":null,"directory_fsync_supported":true,"driver_host":"<host>","file_lock_required":false,"filesystem_type":"ext4","hardlink_required":false,"max_metadata_visibility_latency_seconds":6.910099182277918e-05,"reopen_after_rename_sha256":"ca579451224bd74f92c0f5ad155d59c75a3cea3c25c617be4e67801381d7e4c4","same_directory_atomic_replace_visible":true,"same_directory_replace_latency_seconds":1.929901191033423e-05,"symlink_policy":{"symlink_create_allowed":true,"symlink_target":"rename_probe.dat"},"symlink_required":false,"worker_hosts":["<host>"]},"capability_digest":"580e85712ed2a2aeae92624fb06628ce0115e848a8e45d48b5b6d3cb55ff1fc9","run_digest":"2d6907dddc780ff650edf53083ed1f0ff71c645a0b460b8e27ccfd676ef61f0e","schema":"mosaic.fs_capability","schema_version":1}
