{"capabilities":{"cross_host_read_after_rename":[{"error":null,"file_sha256":"9f4fcefc5026d54a2a076d1c9e24dbbc8e21e61c748764f51fa8fa06edaa2643","host":"<host>","ok":true},{"error":null,"file_sha256":"9f4fcefc5026d54a2a076d1c9e24dbbc8e21e61c748764f51fa8fa06edaa2643","host":"<host>","ok":true}],"cross_host_required":false,"directory_fsync_error":null,"directory_fsync_supported":true,"driver_host":"<host>","file_lock_required":false,"filesystem_type":"ext4","hardlink_required":false,"max_metadata_visibility_latency_seconds":0.00017668699729256332,"reopen_after_rename_sha256":"9f4fcefc5026d54a2a076d1c9e24dbbc8e21e61c748764f51fa8fa06edaa2643","same_directory_atomic_replace_visible":true,"same_directory_replace_latency_seconds":2.2697000531479716e-05,"symlink_policy":{"symlink_create_allowed":true,"symlink_target":"rename_probe.dat"},"symlink_required":false,"worker_hosts":["<host>"]},"capability_digest":"c7deaa2d480abd36aaa302ecaaa43f7ce41a431d9d3b7e40133c2e77dd2db4cc","run_digest":"d1d8edcd29109e1712d9d06e2bf4ec5dbd89ce42133b9093e6439a45943eca6e","schema":"mosaic.fs_capability","schema_version":1}
