{"capabilities":{"cross_host_read_after_rename":[{"error":null,"file_sha256":"ed34753dec4a9c8a4bd83c1d1dc968226458393e6657caaf548f2a9f318d3af9","host":"<host>","ok":true},{"error":null,"file_sha256":"ed34753dec4a9c8a4bd83c1d1dc968226458393e6657caaf548f2a9f318d3af9","host":"<host>","ok":true}],"cross_host_required":false,"directory_fsync_error":null,"directory_fsync_supported":true,"driver_host":"<host>","file_lock_required":false,"filesystem_type":"ext4","hardlink_required":false,"max_metadata_visibility_latency_seconds":3.6807003198191524e-05,"reopen_after_rename_sha256":"ed34753dec4a9c8a4bd83c1d1dc968226458393e6657caaf548f2a9f318d3af9","same_directory_atomic_replace_visible":true,"same_directory_replace_latency_seconds":5.0279981223866343e-05,"symlink_policy":{"symlink_create_allowed":true,"symlink_target":"rename_probe.dat"},"symlink_required":false,"worker_hosts":["<host>"]},"capability_digest":"8c29e72724aa4c72a7ab82cabf7b394abe45c528fa33e8f50d0496560a28dcec","run_digest":"0bcc03d285b0a56edd5bad3c1b4bd296","schema":"mosaic.fs_capability","schema_version":1}
